Loaded module: cuda/12.4
Loaded dependency [python3/3.11.9]: sqlite3/3.45.3
Loaded dependency [python3/3.11.9]: gcc/12.3.0-binutils-2.40
Loaded module: python3/3.11.9

Loading python3/3.11.9
  Loading requirement: sqlite3/3.45.3 gcc/12.3.0-binutils-2.40

[notice] A new release of pip is available: 24.0 -> 25.3
[notice] To update, run: pip install --upgrade pip

[notice] A new release of pip is available: 24.0 -> 25.3
[notice] To update, run: pip install --upgrade pip

[notice] A new release of pip is available: 24.0 -> 25.3
[notice] To update, run: pip install --upgrade pip
2025-11-26 17:25:19,388 - INFO - ============================================================
2025-11-26 17:25:19,388 - INFO - Sequence Length Hyperparameter Search
2025-11-26 17:25:19,388 - INFO - ============================================================
2025-11-26 17:25:19,388 - INFO - Sequence lengths to test: [24, 48, 72, 96, 120, 144, 168, 192, 240, 336]
2025-11-26 17:25:19,388 - INFO - Epochs per fold: 150
2025-11-26 17:25:19,388 - INFO - Batch size: 32
2025-11-26 17:25:19,388 - INFO - Learning rate: 0.001
2025-11-26 17:25:19,436 - INFO - Device: cuda
2025-11-26 17:25:19,437 - INFO - Loading data from /zhome/18/a/187109/projects/CI_for_energy_price_forecasting/data/energy_data.csv...
2025-11-26 17:25:19,521 - INFO - Training data: 7026 samples
2025-11-26 17:25:19,521 - INFO - Date range: 2022-02-01 00:00:00+00:00 to 2022-11-20 17:00:00+00:00
/zhome/18/a/187109/projects/CI_for_energy_price_forecasting/src/seq_len_search.py:113: UserWarning: Converting to PeriodArray/Index representation will drop timezone information.
  df['month_year'] = df['date_time'].dt.to_period('M')
2025-11-26 17:25:19,533 - INFO - Created 6 walk-forward CV folds
2025-11-26 17:25:19,534 - INFO - 
2025-11-26 17:25:19,534 - INFO - ============================================================
2025-11-26 17:25:19,534 - INFO - Testing sequence length: 24 hours (1.0 days)
2025-11-26 17:25:19,534 - INFO - ============================================================
2025-11-26 17:25:19,534 - INFO -   Fold 1/6: Train 2022-02-2022-05 → Test 2022-06
2025-11-26 17:25:28,799 - INFO -     Epoch 25: MSE=805.84, MAE=22.07, RMSE=28.39
2025-11-26 17:25:34,728 - INFO -     Epoch 50: MSE=940.64, MAE=22.57, RMSE=30.67
2025-11-26 17:25:40,998 - INFO -     Epoch 75: MSE=1029.05, MAE=24.38, RMSE=32.08
2025-11-26 17:25:47,338 - INFO -     Epoch 100: MSE=1086.91, MAE=24.95, RMSE=32.97
2025-11-26 17:25:53,655 - INFO -     Epoch 125: MSE=1080.41, MAE=23.51, RMSE=32.87
2025-11-26 17:25:59,983 - INFO -     Epoch 150: MSE=1147.66, MAE=25.14, RMSE=33.88
2025-11-26 17:25:59,984 - INFO -   Fold 2/6: Train 2022-02-2022-06 → Test 2022-07
2025-11-26 17:26:07,728 - INFO -     Epoch 25: MSE=941.14, MAE=23.61, RMSE=30.68
2025-11-26 17:26:15,294 - INFO -     Epoch 50: MSE=1036.51, MAE=23.86, RMSE=32.19
2025-11-26 17:26:22,627 - INFO -     Epoch 75: MSE=1024.99, MAE=23.73, RMSE=32.02
2025-11-26 17:26:30,146 - INFO -     Epoch 100: MSE=1129.94, MAE=24.39, RMSE=33.61
2025-11-26 17:26:37,888 - INFO -     Epoch 125: MSE=1165.39, MAE=24.66, RMSE=34.14
2025-11-26 17:26:45,599 - INFO -     Epoch 150: MSE=1173.24, MAE=24.81, RMSE=34.25
2025-11-26 17:26:45,600 - INFO -   Fold 3/6: Train 2022-02-2022-07 → Test 2022-08
2025-11-26 17:26:54,622 - INFO -     Epoch 25: MSE=1103.32, MAE=26.34, RMSE=33.22
2025-11-26 17:27:03,741 - INFO -     Epoch 50: MSE=1320.65, MAE=27.28, RMSE=36.34
2025-11-26 17:27:12,852 - INFO -     Epoch 75: MSE=1911.11, MAE=32.74, RMSE=43.72
2025-11-26 17:27:22,076 - INFO -     Epoch 100: MSE=2367.24, MAE=37.22, RMSE=48.65
2025-11-26 17:27:31,326 - INFO -     Epoch 125: MSE=1869.27, MAE=32.61, RMSE=43.24
2025-11-26 17:27:40,581 - INFO -     Epoch 150: MSE=2568.19, MAE=39.43, RMSE=50.68
2025-11-26 17:27:40,581 - INFO -   Fold 4/6: Train 2022-02-2022-08 → Test 2022-09
2025-11-26 17:27:51,382 - INFO -     Epoch 25: MSE=1756.79, MAE=34.22, RMSE=41.91
2025-11-26 17:28:01,841 - INFO -     Epoch 50: MSE=2419.79, MAE=42.34, RMSE=49.19
2025-11-26 17:28:12,152 - INFO -     Epoch 75: MSE=1298.98, MAE=27.93, RMSE=36.04
2025-11-26 17:28:22,655 - INFO -     Epoch 100: MSE=1968.69, MAE=36.42, RMSE=44.37
2025-11-26 17:28:33,437 - INFO -     Epoch 125: MSE=2023.81, MAE=37.80, RMSE=44.99
2025-11-26 17:28:44,196 - INFO -     Epoch 150: MSE=1137.54, MAE=25.56, RMSE=33.73
2025-11-26 17:28:44,196 - INFO -   Fold 5/6: Train 2022-02-2022-09 → Test 2022-10
2025-11-26 17:28:56,430 - INFO -     Epoch 25: MSE=1196.26, MAE=27.05, RMSE=34.59
2025-11-26 17:29:08,679 - INFO -     Epoch 50: MSE=1648.05, MAE=32.21, RMSE=40.60
2025-11-26 17:29:20,763 - INFO -     Epoch 75: MSE=1715.33, MAE=33.58, RMSE=41.42
2025-11-26 17:29:32,901 - INFO -     Epoch 100: MSE=1995.30, MAE=35.73, RMSE=44.67
2025-11-26 17:29:45,064 - INFO -     Epoch 125: MSE=1901.34, MAE=34.62, RMSE=43.60
2025-11-26 17:29:57,250 - INFO -     Epoch 150: MSE=1956.92, MAE=35.45, RMSE=44.24
2025-11-26 17:29:57,251 - INFO -   Fold 6/6: Train 2022-02-2022-10 → Test 2022-11
2025-11-26 17:30:10,787 - INFO -     Epoch 25: MSE=1506.09, MAE=33.17, RMSE=38.81
2025-11-26 17:30:23,763 - INFO -     Epoch 50: MSE=744.09, MAE=20.74, RMSE=27.28
2025-11-26 17:30:37,260 - INFO -     Epoch 75: MSE=826.14, MAE=22.35, RMSE=28.74
2025-11-26 17:30:50,846 - INFO -     Epoch 100: MSE=1027.09, MAE=25.29, RMSE=32.05
2025-11-26 17:31:03,544 - INFO -     Epoch 125: MSE=776.07, MAE=20.79, RMSE=27.86
2025-11-26 17:31:16,785 - INFO -     Epoch 150: MSE=785.05, MAE=21.56, RMSE=28.02
2025-11-26 17:31:16,792 - INFO -   Best avg MSE: 1078.23 at epoch 40
2025-11-26 17:31:16,792 - INFO - 
2025-11-26 17:31:16,792 - INFO - ============================================================
2025-11-26 17:31:16,792 - INFO - Testing sequence length: 48 hours (2.0 days)
2025-11-26 17:31:16,792 - INFO - ============================================================
2025-11-26 17:31:16,792 - INFO -   Fold 1/6: Train 2022-02-2022-05 → Test 2022-06
2025-11-26 17:31:23,103 - INFO -     Epoch 25: MSE=892.85, MAE=23.07, RMSE=29.88
2025-11-26 17:31:29,447 - INFO -     Epoch 50: MSE=965.94, MAE=22.18, RMSE=31.08
2025-11-26 17:31:35,789 - INFO -     Epoch 75: MSE=1101.86, MAE=23.69, RMSE=33.19
2025-11-26 17:31:41,994 - INFO -     Epoch 100: MSE=1254.18, MAE=24.53, RMSE=35.41
2025-11-26 17:31:48,367 - INFO -     Epoch 125: MSE=1327.38, MAE=25.52, RMSE=36.43
2025-11-26 17:31:54,769 - INFO -     Epoch 150: MSE=1327.49, MAE=25.98, RMSE=36.43
2025-11-26 17:31:54,770 - INFO -   Fold 2/6: Train 2022-02-2022-06 → Test 2022-07
2025-11-26 17:32:02,556 - INFO -     Epoch 25: MSE=940.24, MAE=22.76, RMSE=30.66
2025-11-26 17:32:10,368 - INFO -     Epoch 50: MSE=1132.63, MAE=25.36, RMSE=33.65
2025-11-26 17:32:18,212 - INFO -     Epoch 75: MSE=1094.58, MAE=24.53, RMSE=33.08
2025-11-26 17:32:26,036 - INFO -     Epoch 100: MSE=1165.51, MAE=26.28, RMSE=34.14
2025-11-26 17:32:33,891 - INFO -     Epoch 125: MSE=1072.20, MAE=24.98, RMSE=32.74
2025-11-26 17:32:41,712 - INFO -     Epoch 150: MSE=994.57, MAE=23.85, RMSE=31.54
2025-11-26 17:32:41,713 - INFO -   Fold 3/6: Train 2022-02-2022-07 → Test 2022-08
2025-11-26 17:32:51,167 - INFO -     Epoch 25: MSE=953.80, MAE=23.67, RMSE=30.88
2025-11-26 17:33:00,609 - INFO -     Epoch 50: MSE=1285.67, MAE=27.16, RMSE=35.86
2025-11-26 17:33:10,054 - INFO -     Epoch 75: MSE=1147.55, MAE=25.62, RMSE=33.88
2025-11-26 17:33:19,099 - INFO -     Epoch 100: MSE=1499.45, MAE=29.08, RMSE=38.72
2025-11-26 17:33:28,229 - INFO -     Epoch 125: MSE=1975.66, MAE=33.82, RMSE=44.45
2025-11-26 17:33:37,675 - INFO -     Epoch 150: MSE=1923.51, MAE=32.89, RMSE=43.86
2025-11-26 17:33:37,676 - INFO -   Fold 4/6: Train 2022-02-2022-08 → Test 2022-09
2025-11-26 17:33:48,608 - INFO -     Epoch 25: MSE=1949.85, MAE=35.30, RMSE=44.16
2025-11-26 17:33:59,500 - INFO -     Epoch 50: MSE=1176.15, MAE=25.90, RMSE=34.30
2025-11-26 17:34:10,263 - INFO -     Epoch 75: MSE=1699.99, MAE=31.53, RMSE=41.23
2025-11-26 17:34:20,871 - INFO -     Epoch 100: MSE=1781.72, MAE=31.93, RMSE=42.21
2025-11-26 17:34:31,770 - INFO -     Epoch 125: MSE=2551.18, MAE=41.80, RMSE=50.51
2025-11-26 17:34:42,646 - INFO -     Epoch 150: MSE=1450.55, MAE=29.67, RMSE=38.09
2025-11-26 17:34:42,647 - INFO -   Fold 5/6: Train 2022-02-2022-09 → Test 2022-10
2025-11-26 17:34:55,065 - INFO -     Epoch 25: MSE=1193.83, MAE=27.65, RMSE=34.55
2025-11-26 17:35:07,244 - INFO -     Epoch 50: MSE=1280.56, MAE=28.72, RMSE=35.78
2025-11-26 17:35:18,978 - INFO -     Epoch 75: MSE=1460.04, MAE=30.87, RMSE=38.21
2025-11-26 17:35:30,445 - INFO -     Epoch 100: MSE=1449.19, MAE=30.71, RMSE=38.07
2025-11-26 17:35:42,432 - INFO -     Epoch 125: MSE=2088.25, MAE=37.66, RMSE=45.70
2025-11-26 17:35:54,641 - INFO -     Epoch 150: MSE=1734.50, MAE=33.48, RMSE=41.65
2025-11-26 17:35:54,642 - INFO -   Fold 6/6: Train 2022-02-2022-10 → Test 2022-11
2025-11-26 17:36:08,317 - INFO -     Epoch 25: MSE=823.73, MAE=23.83, RMSE=28.70
2025-11-26 17:36:21,448 - INFO -     Epoch 50: MSE=776.69, MAE=22.50, RMSE=27.87
2025-11-26 17:36:34,667 - INFO -     Epoch 75: MSE=697.35, MAE=21.01, RMSE=26.41
2025-11-26 17:36:48,228 - INFO -     Epoch 100: MSE=808.50, MAE=22.91, RMSE=28.43
2025-11-26 17:37:01,774 - INFO -     Epoch 125: MSE=926.05, MAE=24.04, RMSE=30.43
2025-11-26 17:37:14,947 - INFO -     Epoch 150: MSE=777.60, MAE=22.08, RMSE=27.89
2025-11-26 17:37:14,951 - INFO -   Best avg MSE: 1007.06 at epoch 31
2025-11-26 17:37:14,951 - INFO - 
2025-11-26 17:37:14,951 - INFO - ============================================================
2025-11-26 17:37:14,951 - INFO - Testing sequence length: 72 hours (3.0 days)
2025-11-26 17:37:14,951 - INFO - ============================================================
2025-11-26 17:37:14,951 - INFO -   Fold 1/6: Train 2022-02-2022-05 → Test 2022-06
2025-11-26 17:37:21,267 - INFO -     Epoch 25: MSE=1149.99, MAE=23.76, RMSE=33.91
2025-11-26 17:37:27,596 - INFO -     Epoch 50: MSE=1292.04, MAE=25.61, RMSE=35.94
2025-11-26 17:37:33,861 - INFO -     Epoch 75: MSE=1315.86, MAE=26.19, RMSE=36.27
2025-11-26 17:37:40,159 - INFO -     Epoch 100: MSE=1486.30, MAE=28.06, RMSE=38.55
2025-11-26 17:37:46,465 - INFO -     Epoch 125: MSE=1926.15, MAE=32.06, RMSE=43.89
2025-11-26 17:37:52,784 - INFO -     Epoch 150: MSE=1740.19, MAE=30.30, RMSE=41.72
2025-11-26 17:37:52,784 - INFO -   Fold 2/6: Train 2022-02-2022-06 → Test 2022-07
2025-11-26 17:38:00,597 - INFO -     Epoch 25: MSE=754.68, MAE=20.15, RMSE=27.47
2025-11-26 17:38:08,374 - INFO -     Epoch 50: MSE=1100.08, MAE=25.05, RMSE=33.17
2025-11-26 17:38:16,202 - INFO -     Epoch 75: MSE=960.01, MAE=22.71, RMSE=30.98
2025-11-26 17:38:23,939 - INFO -     Epoch 100: MSE=1069.81, MAE=23.71, RMSE=32.71
2025-11-26 17:38:31,744 - INFO -     Epoch 125: MSE=1090.52, MAE=23.80, RMSE=33.02
2025-11-26 17:38:39,538 - INFO -     Epoch 150: MSE=1084.36, MAE=24.25, RMSE=32.93
2025-11-26 17:38:39,539 - INFO -   Fold 3/6: Train 2022-02-2022-07 → Test 2022-08
2025-11-26 17:38:48,861 - INFO -     Epoch 25: MSE=1106.88, MAE=25.02, RMSE=33.27
2025-11-26 17:38:57,878 - INFO -     Epoch 50: MSE=1128.70, MAE=25.44, RMSE=33.60
2025-11-26 17:39:07,124 - INFO -     Epoch 75: MSE=1470.72, MAE=29.89, RMSE=38.35
2025-11-26 17:39:16,214 - INFO -     Epoch 100: MSE=1792.16, MAE=32.33, RMSE=42.33
2025-11-26 17:39:25,306 - INFO -     Epoch 125: MSE=2473.34, MAE=38.05, RMSE=49.73
2025-11-26 17:39:34,510 - INFO -     Epoch 150: MSE=2184.09, MAE=35.72, RMSE=46.73
2025-11-26 17:39:34,511 - INFO -   Fold 4/6: Train 2022-02-2022-08 → Test 2022-09
2025-11-26 17:39:45,237 - INFO -     Epoch 25: MSE=3881.29, MAE=53.68, RMSE=62.30
2025-11-26 17:39:55,945 - INFO -     Epoch 50: MSE=1989.51, MAE=35.05, RMSE=44.60
2025-11-26 17:40:06,656 - INFO -     Epoch 75: MSE=3973.53, MAE=54.03, RMSE=63.04
2025-11-26 17:40:17,389 - INFO -     Epoch 100: MSE=1617.13, MAE=30.92, RMSE=40.21
2025-11-26 17:40:28,102 - INFO -     Epoch 125: MSE=2424.02, MAE=40.23, RMSE=49.23
2025-11-26 17:40:38,834 - INFO -     Epoch 150: MSE=1667.42, MAE=32.34, RMSE=40.83
2025-11-26 17:40:38,835 - INFO -   Fold 5/6: Train 2022-02-2022-09 → Test 2022-10
2025-11-26 17:40:51,047 - INFO -     Epoch 25: MSE=834.26, MAE=21.61, RMSE=28.88
2025-11-26 17:41:03,233 - INFO -     Epoch 50: MSE=975.04, MAE=23.80, RMSE=31.23
2025-11-26 17:41:15,470 - INFO -     Epoch 75: MSE=1293.65, MAE=28.64, RMSE=35.97
2025-11-26 17:41:27,589 - INFO -     Epoch 100: MSE=1461.17, MAE=30.47, RMSE=38.23
2025-11-26 17:41:39,807 - INFO -     Epoch 125: MSE=1611.42, MAE=31.45, RMSE=40.14
2025-11-26 17:41:51,939 - INFO -     Epoch 150: MSE=1551.37, MAE=31.62, RMSE=39.39
2025-11-26 17:41:51,939 - INFO -   Fold 6/6: Train 2022-02-2022-10 → Test 2022-11
2025-11-26 17:42:05,521 - INFO -     Epoch 25: MSE=761.08, MAE=21.28, RMSE=27.59
2025-11-26 17:42:19,176 - INFO -     Epoch 50: MSE=962.24, MAE=23.64, RMSE=31.02
2025-11-26 17:42:32,797 - INFO -     Epoch 75: MSE=1134.47, MAE=26.93, RMSE=33.68
2025-11-26 17:42:45,612 - INFO -     Epoch 100: MSE=1015.57, MAE=25.53, RMSE=31.87
2025-11-26 17:42:59,239 - INFO -     Epoch 125: MSE=1165.23, MAE=27.80, RMSE=34.14
2025-11-26 17:43:12,821 - INFO -     Epoch 150: MSE=1195.55, MAE=27.41, RMSE=34.58
2025-11-26 17:43:12,825 - INFO -   Best avg MSE: 1077.87 at epoch 53
2025-11-26 17:43:12,825 - INFO - 
2025-11-26 17:43:12,825 - INFO - ============================================================
2025-11-26 17:43:12,825 - INFO - Testing sequence length: 96 hours (4.0 days)
2025-11-26 17:43:12,825 - INFO - ============================================================
2025-11-26 17:43:12,825 - INFO -   Fold 1/6: Train 2022-02-2022-05 → Test 2022-06
2025-11-26 17:43:19,116 - INFO -     Epoch 25: MSE=1029.40, MAE=25.78, RMSE=32.08
2025-11-26 17:43:25,414 - INFO -     Epoch 50: MSE=1202.88, MAE=28.40, RMSE=34.68
2025-11-26 17:43:31,685 - INFO -     Epoch 75: MSE=1039.53, MAE=24.95, RMSE=32.24
2025-11-26 17:43:37,796 - INFO -     Epoch 100: MSE=1284.19, MAE=27.53, RMSE=35.84
2025-11-26 17:43:44,081 - INFO -     Epoch 125: MSE=1611.48, MAE=33.34, RMSE=40.14
2025-11-26 17:43:50,357 - INFO -     Epoch 150: MSE=1412.45, MAE=29.31, RMSE=37.58
2025-11-26 17:43:50,357 - INFO -   Fold 2/6: Train 2022-02-2022-06 → Test 2022-07
2025-11-26 17:43:58,201 - INFO -     Epoch 25: MSE=1228.06, MAE=26.55, RMSE=35.04
2025-11-26 17:44:06,016 - INFO -     Epoch 50: MSE=1171.81, MAE=25.96, RMSE=34.23
2025-11-26 17:44:13,833 - INFO -     Epoch 75: MSE=1162.28, MAE=26.00, RMSE=34.09
2025-11-26 17:44:21,649 - INFO -     Epoch 100: MSE=1153.38, MAE=25.88, RMSE=33.96
2025-11-26 17:44:29,475 - INFO -     Epoch 125: MSE=1111.18, MAE=25.55, RMSE=33.33
2025-11-26 17:44:37,322 - INFO -     Epoch 150: MSE=1126.61, MAE=25.80, RMSE=33.57
2025-11-26 17:44:37,323 - INFO -   Fold 3/6: Train 2022-02-2022-07 → Test 2022-08
2025-11-26 17:44:46,535 - INFO -     Epoch 25: MSE=837.60, MAE=21.48, RMSE=28.94
2025-11-26 17:44:55,315 - INFO -     Epoch 50: MSE=1360.07, MAE=27.84, RMSE=36.88
2025-11-26 17:45:04,663 - INFO -     Epoch 75: MSE=1707.54, MAE=31.40, RMSE=41.32
2025-11-26 17:45:14,022 - INFO -     Epoch 100: MSE=2249.25, MAE=36.67, RMSE=47.43
2025-11-26 17:45:23,170 - INFO -     Epoch 125: MSE=2212.67, MAE=35.89, RMSE=47.04
2025-11-26 17:45:32,529 - INFO -     Epoch 150: MSE=2741.55, MAE=40.36, RMSE=52.36
2025-11-26 17:45:32,530 - INFO -   Fold 4/6: Train 2022-02-2022-08 → Test 2022-09
2025-11-26 17:45:43,422 - INFO -     Epoch 25: MSE=3805.95, MAE=55.28, RMSE=61.69
2025-11-26 17:45:54,256 - INFO -     Epoch 50: MSE=1334.48, MAE=27.77, RMSE=36.53
2025-11-26 17:46:05,094 - INFO -     Epoch 75: MSE=3570.55, MAE=51.42, RMSE=59.75
2025-11-26 17:46:15,831 - INFO -     Epoch 100: MSE=3160.54, MAE=47.18, RMSE=56.22
2025-11-26 17:46:26,019 - INFO -     Epoch 125: MSE=2078.00, MAE=37.21, RMSE=45.59
2025-11-26 17:46:36,606 - INFO -     Epoch 150: MSE=1530.06, MAE=30.21, RMSE=39.12
2025-11-26 17:46:36,607 - INFO -   Fold 5/6: Train 2022-02-2022-09 → Test 2022-10
2025-11-26 17:46:48,994 - INFO -     Epoch 25: MSE=999.63, MAE=25.56, RMSE=31.62
2025-11-26 17:47:01,357 - INFO -     Epoch 50: MSE=1222.25, MAE=27.31, RMSE=34.96
2025-11-26 17:47:13,715 - INFO -     Epoch 75: MSE=1759.46, MAE=34.65, RMSE=41.95
2025-11-26 17:47:26,105 - INFO -     Epoch 100: MSE=1942.60, MAE=36.01, RMSE=44.07
2025-11-26 17:47:38,525 - INFO -     Epoch 125: MSE=2035.41, MAE=36.84, RMSE=45.12
2025-11-26 17:47:50,927 - INFO -     Epoch 150: MSE=2262.22, MAE=39.01, RMSE=47.56
2025-11-26 17:47:50,927 - INFO -   Fold 6/6: Train 2022-02-2022-10 → Test 2022-11
2025-11-26 17:48:04,653 - INFO -     Epoch 25: MSE=779.61, MAE=22.79, RMSE=27.92
2025-11-26 17:48:18,387 - INFO -     Epoch 50: MSE=788.89, MAE=22.64, RMSE=28.09
2025-11-26 17:48:32,093 - INFO -     Epoch 75: MSE=861.13, MAE=23.62, RMSE=29.35
2025-11-26 17:48:45,748 - INFO -     Epoch 100: MSE=793.30, MAE=21.32, RMSE=28.17
2025-11-26 17:48:59,330 - INFO -     Epoch 125: MSE=1011.82, MAE=24.98, RMSE=31.81
2025-11-26 17:49:13,041 - INFO -     Epoch 150: MSE=1023.29, MAE=24.77, RMSE=31.99
2025-11-26 17:49:13,045 - INFO -   Best avg MSE: 1107.98 at epoch 32
2025-11-26 17:49:13,045 - INFO - 
2025-11-26 17:49:13,045 - INFO - ============================================================
2025-11-26 17:49:13,045 - INFO - Testing sequence length: 120 hours (5.0 days)
2025-11-26 17:49:13,045 - INFO - ============================================================
2025-11-26 17:49:13,045 - INFO -   Fold 1/6: Train 2022-02-2022-05 → Test 2022-06
2025-11-26 17:49:19,355 - INFO -     Epoch 25: MSE=970.53, MAE=22.95, RMSE=31.15
2025-11-26 17:49:25,358 - INFO -     Epoch 50: MSE=1238.41, MAE=25.87, RMSE=35.19
2025-11-26 17:49:31,709 - INFO -     Epoch 75: MSE=1518.35, MAE=28.29, RMSE=38.97
2025-11-26 17:49:38,034 - INFO -     Epoch 100: MSE=1716.75, MAE=29.54, RMSE=41.43
2025-11-26 17:49:44,399 - INFO -     Epoch 125: MSE=2501.18, MAE=35.59, RMSE=50.01
2025-11-26 17:49:50,767 - INFO -     Epoch 150: MSE=2427.82, MAE=35.04, RMSE=49.27
2025-11-26 17:49:50,767 - INFO -   Fold 2/6: Train 2022-02-2022-06 → Test 2022-07
2025-11-26 17:49:58,597 - INFO -     Epoch 25: MSE=1190.84, MAE=27.07, RMSE=34.51
2025-11-26 17:50:06,456 - INFO -     Epoch 50: MSE=1361.60, MAE=28.71, RMSE=36.90
2025-11-26 17:50:14,228 - INFO -     Epoch 75: MSE=1179.75, MAE=25.71, RMSE=34.35
2025-11-26 17:50:22,100 - INFO -     Epoch 100: MSE=1352.67, MAE=27.32, RMSE=36.78
2025-11-26 17:50:29,743 - INFO -     Epoch 125: MSE=1227.76, MAE=26.27, RMSE=35.04
2025-11-26 17:50:37,591 - INFO -     Epoch 150: MSE=1325.62, MAE=27.50, RMSE=36.41
2025-11-26 17:50:37,592 - INFO -   Fold 3/6: Train 2022-02-2022-07 → Test 2022-08
2025-11-26 17:50:46,999 - INFO -     Epoch 25: MSE=916.98, MAE=23.00, RMSE=30.28
2025-11-26 17:50:56,391 - INFO -     Epoch 50: MSE=1410.88, MAE=28.57, RMSE=37.56
2025-11-26 17:51:05,783 - INFO -     Epoch 75: MSE=2205.86, MAE=36.28, RMSE=46.97
2025-11-26 17:51:15,167 - INFO -     Epoch 100: MSE=2474.39, MAE=38.19, RMSE=49.74
2025-11-26 17:51:24,554 - INFO -     Epoch 125: MSE=2652.42, MAE=40.48, RMSE=51.50
2025-11-26 17:51:33,968 - INFO -     Epoch 150: MSE=3023.43, MAE=42.87, RMSE=54.99
2025-11-26 17:51:33,968 - INFO -   Fold 4/6: Train 2022-02-2022-08 → Test 2022-09
2025-11-26 17:51:44,904 - INFO -     Epoch 25: MSE=3159.57, MAE=48.85, RMSE=56.21
2025-11-26 17:51:55,828 - INFO -     Epoch 50: MSE=1642.56, MAE=30.96, RMSE=40.53
2025-11-26 17:52:06,775 - INFO -     Epoch 75: MSE=1419.32, MAE=28.24, RMSE=37.67
2025-11-26 17:52:17,726 - INFO -     Epoch 100: MSE=1226.60, MAE=26.78, RMSE=35.02
2025-11-26 17:52:28,305 - INFO -     Epoch 125: MSE=1637.04, MAE=31.68, RMSE=40.46
2025-11-26 17:52:39,050 - INFO -     Epoch 150: MSE=1112.68, MAE=25.84, RMSE=33.36
2025-11-26 17:52:39,051 - INFO -   Fold 5/6: Train 2022-02-2022-09 → Test 2022-10
2025-11-26 17:52:51,475 - INFO -     Epoch 25: MSE=1003.09, MAE=24.56, RMSE=31.67
2025-11-26 17:53:03,895 - INFO -     Epoch 50: MSE=1274.75, MAE=28.30, RMSE=35.70
2025-11-26 17:53:16,345 - INFO -     Epoch 75: MSE=1688.42, MAE=33.83, RMSE=41.09
2025-11-26 17:53:28,818 - INFO -     Epoch 100: MSE=2119.59, MAE=38.44, RMSE=46.04
2025-11-26 17:53:41,319 - INFO -     Epoch 125: MSE=1967.40, MAE=36.25, RMSE=44.36
2025-11-26 17:53:53,818 - INFO -     Epoch 150: MSE=2095.14, MAE=38.10, RMSE=45.77
2025-11-26 17:53:53,819 - INFO -   Fold 6/6: Train 2022-02-2022-10 → Test 2022-11
2025-11-26 17:54:07,678 - INFO -     Epoch 25: MSE=1191.36, MAE=28.71, RMSE=34.52
2025-11-26 17:54:21,513 - INFO -     Epoch 50: MSE=738.49, MAE=20.85, RMSE=27.18
2025-11-26 17:54:35,367 - INFO -     Epoch 75: MSE=727.48, MAE=20.73, RMSE=26.97
2025-11-26 17:54:49,200 - INFO -     Epoch 100: MSE=729.10, MAE=21.26, RMSE=27.00
2025-11-26 17:55:02,632 - INFO -     Epoch 125: MSE=692.76, MAE=20.96, RMSE=26.32
2025-11-26 17:55:16,065 - INFO -     Epoch 150: MSE=759.99, MAE=22.08, RMSE=27.57
2025-11-26 17:55:16,080 - INFO -   Best avg MSE: 1144.81 at epoch 42
2025-11-26 17:55:16,080 - INFO - 
2025-11-26 17:55:16,080 - INFO - ============================================================
2025-11-26 17:55:16,080 - INFO - Testing sequence length: 144 hours (6.0 days)
2025-11-26 17:55:16,081 - INFO - ============================================================
2025-11-26 17:55:16,081 - INFO -   Fold 1/6: Train 2022-02-2022-05 → Test 2022-06
2025-11-26 17:55:22,403 - INFO -     Epoch 25: MSE=1233.83, MAE=26.68, RMSE=35.13
2025-11-26 17:55:28,745 - INFO -     Epoch 50: MSE=929.48, MAE=23.63, RMSE=30.49
2025-11-26 17:55:35,073 - INFO -     Epoch 75: MSE=1151.70, MAE=24.00, RMSE=33.94
2025-11-26 17:55:41,422 - INFO -     Epoch 100: MSE=1186.76, MAE=24.14, RMSE=34.45
2025-11-26 17:55:47,800 - INFO -     Epoch 125: MSE=1600.87, MAE=28.53, RMSE=40.01
2025-11-26 17:55:54,112 - INFO -     Epoch 150: MSE=1236.96, MAE=25.21, RMSE=35.17
2025-11-26 17:55:54,113 - INFO -   Fold 2/6: Train 2022-02-2022-06 → Test 2022-07
2025-11-26 17:56:01,877 - INFO -     Epoch 25: MSE=994.11, MAE=24.26, RMSE=31.53
2025-11-26 17:56:09,813 - INFO -     Epoch 50: MSE=1185.74, MAE=25.44, RMSE=34.43
2025-11-26 17:56:17,705 - INFO -     Epoch 75: MSE=1075.64, MAE=24.96, RMSE=32.80
2025-11-26 17:56:25,549 - INFO -     Epoch 100: MSE=1087.71, MAE=25.70, RMSE=32.98
2025-11-26 17:56:33,460 - INFO -     Epoch 125: MSE=1199.92, MAE=26.84, RMSE=34.64
2025-11-26 17:56:41,310 - INFO -     Epoch 150: MSE=1120.45, MAE=25.88, RMSE=33.47
2025-11-26 17:56:41,311 - INFO -   Fold 3/6: Train 2022-02-2022-07 → Test 2022-08
2025-11-26 17:56:50,797 - INFO -     Epoch 25: MSE=1718.60, MAE=31.85, RMSE=41.46
2025-11-26 17:57:00,222 - INFO -     Epoch 50: MSE=2222.65, MAE=37.63, RMSE=47.15
2025-11-26 17:57:09,567 - INFO -     Epoch 75: MSE=2316.30, MAE=36.37, RMSE=48.13
2025-11-26 17:57:19,071 - INFO -     Epoch 100: MSE=2663.02, MAE=39.09, RMSE=51.60
2025-11-26 17:57:28,581 - INFO -     Epoch 125: MSE=2626.33, MAE=39.29, RMSE=51.25
2025-11-26 17:57:38,130 - INFO -     Epoch 150: MSE=3023.49, MAE=43.33, RMSE=54.99
2025-11-26 17:57:38,131 - INFO -   Fold 4/6: Train 2022-02-2022-08 → Test 2022-09
2025-11-26 17:57:49,243 - INFO -     Epoch 25: MSE=2221.41, MAE=38.16, RMSE=47.13
2025-11-26 17:58:00,272 - INFO -     Epoch 50: MSE=2205.56, MAE=39.00, RMSE=46.96
2025-11-26 17:58:11,325 - INFO -     Epoch 75: MSE=2336.68, MAE=39.79, RMSE=48.34
2025-11-26 17:58:22,400 - INFO -     Epoch 100: MSE=1897.02, MAE=34.20, RMSE=43.55
2025-11-26 17:58:33,493 - INFO -     Epoch 125: MSE=2207.38, MAE=36.86, RMSE=46.98
2025-11-26 17:58:44,475 - INFO -     Epoch 150: MSE=4347.19, MAE=56.08, RMSE=65.93
2025-11-26 17:58:44,476 - INFO -   Fold 5/6: Train 2022-02-2022-09 → Test 2022-10
2025-11-26 17:58:56,827 - INFO -     Epoch 25: MSE=964.64, MAE=24.46, RMSE=31.06
2025-11-26 17:59:09,408 - INFO -     Epoch 50: MSE=1476.90, MAE=32.34, RMSE=38.43
2025-11-26 17:59:21,685 - INFO -     Epoch 75: MSE=1225.55, MAE=28.98, RMSE=35.01
2025-11-26 17:59:34,298 - INFO -     Epoch 100: MSE=1904.58, MAE=36.03, RMSE=43.64
2025-11-26 17:59:46,870 - INFO -     Epoch 125: MSE=1444.50, MAE=31.05, RMSE=38.01
2025-11-26 17:59:59,475 - INFO -     Epoch 150: MSE=1607.03, MAE=32.62, RMSE=40.09
2025-11-26 17:59:59,476 - INFO -   Fold 6/6: Train 2022-02-2022-10 → Test 2022-11
2025-11-26 18:00:13,442 - INFO -     Epoch 25: MSE=975.03, MAE=24.95, RMSE=31.23
2025-11-26 18:00:27,218 - INFO -     Epoch 50: MSE=850.49, MAE=22.66, RMSE=29.16
2025-11-26 18:00:41,162 - INFO -     Epoch 75: MSE=814.89, MAE=21.66, RMSE=28.55
2025-11-26 18:00:55,127 - INFO -     Epoch 100: MSE=1061.58, MAE=25.95, RMSE=32.58
2025-11-26 18:01:09,063 - INFO -     Epoch 125: MSE=1063.04, MAE=25.81, RMSE=32.60
2025-11-26 18:01:22,997 - INFO -     Epoch 150: MSE=996.02, MAE=24.65, RMSE=31.56
2025-11-26 18:01:23,001 - INFO -   Best avg MSE: 1201.32 at epoch 41
2025-11-26 18:01:23,001 - INFO - 
2025-11-26 18:01:23,001 - INFO - ============================================================
2025-11-26 18:01:23,001 - INFO - Testing sequence length: 168 hours (7.0 days)
2025-11-26 18:01:23,001 - INFO - ============================================================
2025-11-26 18:01:23,001 - INFO -   Fold 1/6: Train 2022-02-2022-05 → Test 2022-06
2025-11-26 18:01:29,387 - INFO -     Epoch 25: MSE=1304.20, MAE=28.79, RMSE=36.11
2025-11-26 18:01:35,781 - INFO -     Epoch 50: MSE=1375.22, MAE=27.33, RMSE=37.08
2025-11-26 18:01:42,099 - INFO -     Epoch 75: MSE=1518.81, MAE=27.71, RMSE=38.97
2025-11-26 18:01:48,160 - INFO -     Epoch 100: MSE=1695.49, MAE=29.65, RMSE=41.18
2025-11-26 18:01:54,471 - INFO -     Epoch 125: MSE=1643.02, MAE=29.36, RMSE=40.53
2025-11-26 18:02:00,882 - INFO -     Epoch 150: MSE=1662.26, MAE=30.02, RMSE=40.77
2025-11-26 18:02:00,883 - INFO -   Fold 2/6: Train 2022-02-2022-06 → Test 2022-07
2025-11-26 18:02:08,631 - INFO -     Epoch 25: MSE=1209.28, MAE=27.18, RMSE=34.77
2025-11-26 18:02:16,625 - INFO -     Epoch 50: MSE=1166.95, MAE=25.99, RMSE=34.16
2025-11-26 18:02:24,633 - INFO -     Epoch 75: MSE=1238.01, MAE=27.46, RMSE=35.19
2025-11-26 18:02:32,636 - INFO -     Epoch 100: MSE=1286.62, MAE=27.36, RMSE=35.87
2025-11-26 18:02:40,566 - INFO -     Epoch 125: MSE=1190.27, MAE=26.08, RMSE=34.50
2025-11-26 18:02:48,541 - INFO -     Epoch 150: MSE=1189.55, MAE=26.28, RMSE=34.49
2025-11-26 18:02:48,541 - INFO -   Fold 3/6: Train 2022-02-2022-07 → Test 2022-08
2025-11-26 18:02:58,092 - INFO -     Epoch 25: MSE=1148.95, MAE=24.64, RMSE=33.90
2025-11-26 18:03:07,633 - INFO -     Epoch 50: MSE=1230.01, MAE=25.85, RMSE=35.07
2025-11-26 18:03:17,210 - INFO -     Epoch 75: MSE=1748.48, MAE=30.51, RMSE=41.81
2025-11-26 18:03:26,828 - INFO -     Epoch 100: MSE=1378.31, MAE=27.28, RMSE=37.13
2025-11-26 18:03:36,457 - INFO -     Epoch 125: MSE=1360.53, MAE=27.50, RMSE=36.89
2025-11-26 18:03:45,901 - INFO -     Epoch 150: MSE=1388.13, MAE=27.52, RMSE=37.26
2025-11-26 18:03:45,901 - INFO -   Fold 4/6: Train 2022-02-2022-08 → Test 2022-09
2025-11-26 18:03:57,008 - INFO -     Epoch 25: MSE=2423.79, MAE=41.36, RMSE=49.23
2025-11-26 18:04:08,095 - INFO -     Epoch 50: MSE=2913.15, MAE=45.07, RMSE=53.97
2025-11-26 18:04:18,873 - INFO -     Epoch 75: MSE=1109.26, MAE=25.95, RMSE=33.31
2025-11-26 18:04:29,669 - INFO -     Epoch 100: MSE=2153.18, MAE=37.50, RMSE=46.40
2025-11-26 18:04:40,766 - INFO -     Epoch 125: MSE=1156.85, MAE=26.62, RMSE=34.01
2025-11-26 18:04:51,874 - INFO -     Epoch 150: MSE=2032.57, MAE=36.79, RMSE=45.08
2025-11-26 18:04:51,874 - INFO -   Fold 5/6: Train 2022-02-2022-09 → Test 2022-10
2025-11-26 18:05:04,540 - INFO -     Epoch 25: MSE=1227.66, MAE=28.56, RMSE=35.04
2025-11-26 18:05:17,198 - INFO -     Epoch 50: MSE=1657.37, MAE=33.81, RMSE=40.71
2025-11-26 18:05:29,905 - INFO -     Epoch 75: MSE=2074.71, MAE=38.98, RMSE=45.55
2025-11-26 18:05:42,600 - INFO -     Epoch 100: MSE=2171.66, MAE=39.40, RMSE=46.60
2025-11-26 18:05:55,274 - INFO -     Epoch 125: MSE=2106.75, MAE=39.07, RMSE=45.90
2025-11-26 18:06:07,924 - INFO -     Epoch 150: MSE=1919.79, MAE=37.18, RMSE=43.82
2025-11-26 18:06:07,925 - INFO -   Fold 6/6: Train 2022-02-2022-10 → Test 2022-11
2025-11-26 18:06:21,946 - INFO -     Epoch 25: MSE=746.89, MAE=20.49, RMSE=27.33
2025-11-26 18:06:35,985 - INFO -     Epoch 50: MSE=758.00, MAE=21.01, RMSE=27.53
2025-11-26 18:06:49,994 - INFO -     Epoch 75: MSE=1042.35, MAE=25.33, RMSE=32.29
2025-11-26 18:07:04,062 - INFO -     Epoch 100: MSE=840.31, MAE=20.88, RMSE=28.99
2025-11-26 18:07:18,184 - INFO -     Epoch 125: MSE=739.76, MAE=19.87, RMSE=27.20
2025-11-26 18:07:32,277 - INFO -     Epoch 150: MSE=858.33, MAE=21.59, RMSE=29.30
2025-11-26 18:07:32,281 - INFO -   Best avg MSE: 1131.34 at epoch 33
2025-11-26 18:07:32,281 - INFO - 
2025-11-26 18:07:32,281 - INFO - ============================================================
2025-11-26 18:07:32,281 - INFO - Testing sequence length: 192 hours (8.0 days)
2025-11-26 18:07:32,281 - INFO - ============================================================
2025-11-26 18:07:32,281 - INFO -   Fold 1/6: Train 2022-02-2022-05 → Test 2022-06
2025-11-26 18:07:38,715 - INFO -     Epoch 25: MSE=1208.32, MAE=25.04, RMSE=34.76
2025-11-26 18:07:45,110 - INFO -     Epoch 50: MSE=1038.99, MAE=23.55, RMSE=32.23
2025-11-26 18:07:51,526 - INFO -     Epoch 75: MSE=1155.72, MAE=24.21, RMSE=34.00
2025-11-26 18:07:57,938 - INFO -     Epoch 100: MSE=1143.88, MAE=24.76, RMSE=33.82
2025-11-26 18:08:04,322 - INFO -     Epoch 125: MSE=1270.78, MAE=25.72, RMSE=35.65
2025-11-26 18:08:10,677 - INFO -     Epoch 150: MSE=1610.30, MAE=30.43, RMSE=40.13
2025-11-26 18:08:10,678 - INFO -   Fold 2/6: Train 2022-02-2022-06 → Test 2022-07
2025-11-26 18:08:18,567 - INFO -     Epoch 25: MSE=1512.16, MAE=30.23, RMSE=38.89
2025-11-26 18:08:26,566 - INFO -     Epoch 50: MSE=1359.31, MAE=28.13, RMSE=36.87
2025-11-26 18:08:34,441 - INFO -     Epoch 75: MSE=1375.34, MAE=27.60, RMSE=37.09
2025-11-26 18:08:42,449 - INFO -     Epoch 100: MSE=1123.40, MAE=25.59, RMSE=33.52
2025-11-26 18:08:50,457 - INFO -     Epoch 125: MSE=1537.76, MAE=29.30, RMSE=39.21
2025-11-26 18:08:58,488 - INFO -     Epoch 150: MSE=1204.45, MAE=26.44, RMSE=34.71
2025-11-26 18:08:58,489 - INFO -   Fold 3/6: Train 2022-02-2022-07 → Test 2022-08
2025-11-26 18:09:08,042 - INFO -     Epoch 25: MSE=1397.23, MAE=28.88, RMSE=37.38
2025-11-26 18:09:17,637 - INFO -     Epoch 50: MSE=1642.12, MAE=30.28, RMSE=40.52
2025-11-26 18:09:27,308 - INFO -     Epoch 75: MSE=2319.57, MAE=37.65, RMSE=48.16
2025-11-26 18:09:36,979 - INFO -     Epoch 100: MSE=2196.43, MAE=36.20, RMSE=46.87
2025-11-26 18:09:46,591 - INFO -     Epoch 125: MSE=2699.39, MAE=41.62, RMSE=51.96
2025-11-26 18:09:56,213 - INFO -     Epoch 150: MSE=2514.00, MAE=39.10, RMSE=50.14
2025-11-26 18:09:56,213 - INFO -   Fold 4/6: Train 2022-02-2022-08 → Test 2022-09
2025-11-26 18:10:07,428 - INFO -     Epoch 25: MSE=4024.93, MAE=56.13, RMSE=63.44
2025-11-26 18:10:18,591 - INFO -     Epoch 50: MSE=1658.14, MAE=32.98, RMSE=40.72
2025-11-26 18:10:29,579 - INFO -     Epoch 75: MSE=1863.00, MAE=34.57, RMSE=43.16
2025-11-26 18:10:40,553 - INFO -     Epoch 100: MSE=2301.13, MAE=40.25, RMSE=47.97
2025-11-26 18:10:51,685 - INFO -     Epoch 125: MSE=2054.32, MAE=37.16, RMSE=45.32
2025-11-26 18:11:02,754 - INFO -     Epoch 150: MSE=1923.59, MAE=35.88, RMSE=43.86
2025-11-26 18:11:02,754 - INFO -   Fold 5/6: Train 2022-02-2022-09 → Test 2022-10
2025-11-26 18:11:15,552 - INFO -     Epoch 25: MSE=823.30, MAE=22.49, RMSE=28.69
2025-11-26 18:11:28,359 - INFO -     Epoch 50: MSE=1426.90, MAE=30.46, RMSE=37.77
2025-11-26 18:11:41,147 - INFO -     Epoch 75: MSE=1902.12, MAE=36.13, RMSE=43.61
2025-11-26 18:11:53,747 - INFO -     Epoch 100: MSE=1763.46, MAE=34.46, RMSE=41.99
2025-11-26 18:12:06,183 - INFO -     Epoch 125: MSE=2656.35, MAE=42.95, RMSE=51.54
2025-11-26 18:12:18,893 - INFO -     Epoch 150: MSE=2074.74, MAE=38.04, RMSE=45.55
2025-11-26 18:12:18,893 - INFO -   Fold 6/6: Train 2022-02-2022-10 → Test 2022-11
2025-11-26 18:12:32,936 - INFO -     Epoch 25: MSE=1292.08, MAE=30.02, RMSE=35.95
2025-11-26 18:12:47,122 - INFO -     Epoch 50: MSE=875.68, MAE=22.11, RMSE=29.59
2025-11-26 18:13:01,333 - INFO -     Epoch 75: MSE=799.40, MAE=21.93, RMSE=28.27
2025-11-26 18:13:15,525 - INFO -     Epoch 100: MSE=972.41, MAE=24.79, RMSE=31.18
2025-11-26 18:13:29,665 - INFO -     Epoch 125: MSE=893.03, MAE=23.45, RMSE=29.88
2025-11-26 18:13:43,658 - INFO -     Epoch 150: MSE=1007.68, MAE=24.92, RMSE=31.74
2025-11-26 18:13:43,662 - INFO -   Best avg MSE: 1188.33 at epoch 37
2025-11-26 18:13:43,662 - INFO - 
2025-11-26 18:13:43,662 - INFO - ============================================================
2025-11-26 18:13:43,662 - INFO - Testing sequence length: 240 hours (10.0 days)
2025-11-26 18:13:43,662 - INFO - ============================================================
2025-11-26 18:13:43,662 - INFO -   Fold 1/6: Train 2022-02-2022-05 → Test 2022-06
2025-11-26 18:13:50,129 - INFO -     Epoch 25: MSE=1358.82, MAE=31.19, RMSE=36.86
2025-11-26 18:13:56,599 - INFO -     Epoch 50: MSE=1360.23, MAE=29.91, RMSE=36.88
2025-11-26 18:14:03,079 - INFO -     Epoch 75: MSE=1804.24, MAE=35.09, RMSE=42.48
2025-11-26 18:14:09,559 - INFO -     Epoch 100: MSE=1366.51, MAE=28.77, RMSE=36.97
2025-11-26 18:14:16,080 - INFO -     Epoch 125: MSE=1388.51, MAE=27.87, RMSE=37.26
2025-11-26 18:14:22,608 - INFO -     Epoch 150: MSE=1529.13, MAE=29.65, RMSE=39.10
2025-11-26 18:14:22,608 - INFO -   Fold 2/6: Train 2022-02-2022-06 → Test 2022-07
2025-11-26 18:14:30,724 - INFO -     Epoch 25: MSE=1160.92, MAE=26.79, RMSE=34.07
2025-11-26 18:14:38,832 - INFO -     Epoch 50: MSE=1271.55, MAE=28.50, RMSE=35.66
2025-11-26 18:14:46,933 - INFO -     Epoch 75: MSE=1440.91, MAE=30.74, RMSE=37.96
2025-11-26 18:14:55,033 - INFO -     Epoch 100: MSE=1498.35, MAE=31.37, RMSE=38.71
2025-11-26 18:15:03,110 - INFO -     Epoch 125: MSE=1324.98, MAE=28.40, RMSE=36.40
2025-11-26 18:15:11,221 - INFO -     Epoch 150: MSE=1295.85, MAE=28.17, RMSE=36.00
2025-11-26 18:15:11,222 - INFO -   Fold 3/6: Train 2022-02-2022-07 → Test 2022-08
2025-11-26 18:15:21,076 - INFO -     Epoch 25: MSE=900.29, MAE=22.34, RMSE=30.00
2025-11-26 18:15:30,890 - INFO -     Epoch 50: MSE=1703.21, MAE=32.64, RMSE=41.27
2025-11-26 18:15:40,687 - INFO -     Epoch 75: MSE=1581.53, MAE=30.31, RMSE=39.77
2025-11-26 18:15:50,493 - INFO -     Epoch 100: MSE=1952.52, MAE=33.89, RMSE=44.19
2025-11-26 18:16:00,389 - INFO -     Epoch 125: MSE=1683.57, MAE=30.88, RMSE=41.03
2025-11-26 18:16:10,033 - INFO -     Epoch 150: MSE=2075.44, MAE=34.54, RMSE=45.56
2025-11-26 18:16:10,033 - INFO -   Fold 4/6: Train 2022-02-2022-08 → Test 2022-09
2025-11-26 18:16:21,246 - INFO -     Epoch 25: MSE=3264.35, MAE=49.10, RMSE=57.13
2025-11-26 18:16:32,640 - INFO -     Epoch 50: MSE=2065.29, MAE=38.21, RMSE=45.45
2025-11-26 18:16:44,061 - INFO -     Epoch 75: MSE=1834.76, MAE=33.98, RMSE=42.83
2025-11-26 18:16:55,025 - INFO -     Epoch 100: MSE=2381.14, MAE=40.68, RMSE=48.80
2025-11-26 18:17:06,495 - INFO -     Epoch 125: MSE=1683.65, MAE=31.93, RMSE=41.03
2025-11-26 18:17:17,922 - INFO -     Epoch 150: MSE=2201.88, MAE=36.99, RMSE=46.92
2025-11-26 18:17:17,923 - INFO -   Fold 5/6: Train 2022-02-2022-09 → Test 2022-10
2025-11-26 18:17:30,848 - INFO -     Epoch 25: MSE=1207.92, MAE=27.50, RMSE=34.76
2025-11-26 18:17:43,882 - INFO -     Epoch 50: MSE=1383.67, MAE=29.78, RMSE=37.20
2025-11-26 18:17:56,937 - INFO -     Epoch 75: MSE=1410.51, MAE=29.90, RMSE=37.56
2025-11-26 18:18:09,969 - INFO -     Epoch 100: MSE=1583.64, MAE=32.38, RMSE=39.79
2025-11-26 18:18:23,014 - INFO -     Epoch 125: MSE=1441.11, MAE=31.06, RMSE=37.96
2025-11-26 18:18:36,034 - INFO -     Epoch 150: MSE=1513.68, MAE=31.80, RMSE=38.91
2025-11-26 18:18:36,035 - INFO -   Fold 6/6: Train 2022-02-2022-10 → Test 2022-11
2025-11-26 18:18:50,499 - INFO -     Epoch 25: MSE=1088.48, MAE=25.39, RMSE=32.99
2025-11-26 18:19:04,837 - INFO -     Epoch 50: MSE=872.12, MAE=22.92, RMSE=29.53
2025-11-26 18:19:19,017 - INFO -     Epoch 75: MSE=1016.92, MAE=24.02, RMSE=31.89
2025-11-26 18:19:32,932 - INFO -     Epoch 100: MSE=862.46, MAE=21.50, RMSE=29.37
2025-11-26 18:19:47,202 - INFO -     Epoch 125: MSE=1183.30, MAE=26.10, RMSE=34.40
2025-11-26 18:20:01,558 - INFO -     Epoch 150: MSE=931.62, MAE=22.56, RMSE=30.52
2025-11-26 18:20:01,562 - INFO -   Best avg MSE: 1233.16 at epoch 37
2025-11-26 18:20:01,562 - INFO - 
2025-11-26 18:20:01,562 - INFO - ============================================================
2025-11-26 18:20:01,562 - INFO - Testing sequence length: 336 hours (14.0 days)
2025-11-26 18:20:01,562 - INFO - ============================================================
2025-11-26 18:20:01,562 - INFO -   Fold 1/6: Train 2022-02-2022-05 → Test 2022-06
2025-11-26 18:20:08,131 - INFO -     Epoch 25: MSE=2466.30, MAE=36.97, RMSE=49.66
2025-11-26 18:20:14,696 - INFO -     Epoch 50: MSE=2091.34, MAE=34.51, RMSE=45.73
2025-11-26 18:20:21,137 - INFO -     Epoch 75: MSE=1909.81, MAE=32.04, RMSE=43.70
2025-11-26 18:20:27,712 - INFO -     Epoch 100: MSE=2464.19, MAE=36.29, RMSE=49.64
2025-11-26 18:20:34,293 - INFO -     Epoch 125: MSE=2607.14, MAE=37.29, RMSE=51.06
2025-11-26 18:20:40,832 - INFO -     Epoch 150: MSE=2487.57, MAE=36.64, RMSE=49.88
2025-11-26 18:20:40,833 - INFO -   Fold 2/6: Train 2022-02-2022-06 → Test 2022-07
2025-11-26 18:20:48,981 - INFO -     Epoch 25: MSE=1301.70, MAE=28.38, RMSE=36.08
2025-11-26 18:20:57,220 - INFO -     Epoch 50: MSE=1502.25, MAE=30.30, RMSE=38.76
2025-11-26 18:21:05,473 - INFO -     Epoch 75: MSE=1568.15, MAE=30.81, RMSE=39.60
2025-11-26 18:21:13,730 - INFO -     Epoch 100: MSE=1443.10, MAE=29.48, RMSE=37.99
2025-11-26 18:21:21,993 - INFO -     Epoch 125: MSE=1287.79, MAE=27.58, RMSE=35.89
2025-11-26 18:21:30,282 - INFO -     Epoch 150: MSE=1378.46, MAE=28.65, RMSE=37.13
2025-11-26 18:21:30,283 - INFO -   Fold 3/6: Train 2022-02-2022-07 → Test 2022-08
2025-11-26 18:21:40,347 - INFO -     Epoch 25: MSE=1470.13, MAE=30.85, RMSE=38.34
2025-11-26 18:21:50,471 - INFO -     Epoch 50: MSE=1295.33, MAE=27.09, RMSE=35.99
2025-11-26 18:22:00,503 - INFO -     Epoch 75: MSE=1847.47, MAE=32.72, RMSE=42.98
2025-11-26 18:22:10,565 - INFO -     Epoch 100: MSE=1797.59, MAE=32.50, RMSE=42.40
2025-11-26 18:22:20,685 - INFO -     Epoch 125: MSE=1699.17, MAE=31.31, RMSE=41.22
2025-11-26 18:22:30,792 - INFO -     Epoch 150: MSE=2267.66, MAE=36.28, RMSE=47.62
2025-11-26 18:22:30,792 - INFO -   Fold 4/6: Train 2022-02-2022-08 → Test 2022-09
2025-11-26 18:22:42,622 - INFO -     Epoch 25: MSE=2811.82, MAE=45.58, RMSE=53.03
2025-11-26 18:22:54,355 - INFO -     Epoch 50: MSE=3281.21, MAE=49.25, RMSE=57.28
2025-11-26 18:23:06,102 - INFO -     Epoch 75: MSE=2440.46, MAE=41.85, RMSE=49.40
2025-11-26 18:23:17,859 - INFO -     Epoch 100: MSE=1653.20, MAE=33.00, RMSE=40.66
2025-11-26 18:23:29,602 - INFO -     Epoch 125: MSE=1985.38, MAE=35.90, RMSE=44.56
2025-11-26 18:23:41,344 - INFO -     Epoch 150: MSE=1952.34, MAE=35.67, RMSE=44.19
2025-11-26 18:23:41,345 - INFO -   Fold 5/6: Train 2022-02-2022-09 → Test 2022-10
2025-11-26 18:23:54,870 - INFO -     Epoch 25: MSE=1425.50, MAE=31.00, RMSE=37.76
2025-11-26 18:24:08,307 - INFO -     Epoch 50: MSE=1497.41, MAE=32.48, RMSE=38.70
2025-11-26 18:24:21,732 - INFO -     Epoch 75: MSE=1589.93, MAE=33.50, RMSE=39.87
2025-11-26 18:24:34,974 - INFO -     Epoch 100: MSE=1928.04, MAE=36.57, RMSE=43.91
2025-11-26 18:24:48,058 - INFO -     Epoch 125: MSE=1847.58, MAE=36.30, RMSE=42.98
2025-11-26 18:25:01,408 - INFO -     Epoch 150: MSE=2095.27, MAE=39.44, RMSE=45.77
2025-11-26 18:25:01,409 - INFO -   Fold 6/6: Train 2022-02-2022-10 → Test 2022-11
2025-11-26 18:25:16,299 - INFO -     Epoch 25: MSE=1382.40, MAE=31.12, RMSE=37.18
2025-11-26 18:25:31,278 - INFO -     Epoch 50: MSE=755.07, MAE=21.09, RMSE=27.48
2025-11-26 18:25:46,203 - INFO -     Epoch 75: MSE=1295.36, MAE=28.75, RMSE=35.99
2025-11-26 18:26:01,105 - INFO -     Epoch 100: MSE=743.59, MAE=20.63, RMSE=27.27
2025-11-26 18:26:16,018 - INFO -     Epoch 125: MSE=751.93, MAE=20.27, RMSE=27.42
2025-11-26 18:26:30,926 - INFO -     Epoch 150: MSE=762.15, MAE=20.84, RMSE=27.61
2025-11-26 18:26:30,930 - INFO -   Best avg MSE: 1380.46 at epoch 40
2025-11-26 18:26:30,998 - INFO - 
Full results saved to: /zhome/18/a/187109/projects/CI_for_energy_price_forecasting/results/seq_len_search_results_20251126_172519.csv
2025-11-26 18:26:31,016 - INFO - Summary saved to: /zhome/18/a/187109/projects/CI_for_energy_price_forecasting/results/seq_len_search_summary_20251126_172519.json
2025-11-26 18:26:31,017 - INFO - 
2025-11-26 18:26:31,017 - INFO - ============================================================
2025-11-26 18:26:31,017 - INFO - FINAL SUMMARY
2025-11-26 18:26:31,017 - INFO - ============================================================
2025-11-26 18:26:31,017 - INFO -    Seq Len     Days   Best Epoch          MSE        MAE       RMSE
2025-11-26 18:26:31,017 - INFO - ------------------------------------------------------------
2025-11-26 18:26:31,017 - INFO -         24      1.0           40      1078.23      25.10      32.70
2025-11-26 18:26:31,017 - INFO -         48      2.0           31      1007.06      24.04      31.22
2025-11-26 18:26:31,017 - INFO -         72      3.0           53      1077.87      24.97      32.77
2025-11-26 18:26:31,017 - INFO -         96      4.0           32      1107.98      25.79      32.73
2025-11-26 18:26:31,017 - INFO -        120      5.0           42      1144.81      25.42      33.49
2025-11-26 18:26:31,017 - INFO -        144      6.0           41      1201.32      26.55      34.30
2025-11-26 18:26:31,017 - INFO -        168      7.0           33      1131.34      25.82      33.45
2025-11-26 18:26:31,017 - INFO -        192      8.0           37      1188.33      26.25      34.01
2025-11-26 18:26:31,017 - INFO -        240     10.0           37      1233.16      27.49      34.81
2025-11-26 18:26:31,017 - INFO -        336     14.0           40      1380.46      28.78      36.92
2025-11-26 18:26:31,017 - INFO - ------------------------------------------------------------
2025-11-26 18:26:31,017 - INFO - 
Best sequence length: 48 hours (2.0 days)
2025-11-26 18:26:31,017 - INFO - Best MSE: 1007.06
2025-11-26 18:26:31,017 - INFO - 
2025-11-26 18:26:31,017 - INFO - Search complete!
